example_id,sentence_nl_nl,sentence_en_gb,legal_source_id,book_identifier,article_number,article_title_nl_nl,article_title_en_gb,translation_date,tmx_source_file,tmx_tuid
052d1696-41ce-40a1-bd9e-7d79b6add8a4,"In zaken met betrekking tot echtscheiding, scheiding van tafel en bed, ontbinding van het huwelijk na scheiding van tafel en bed en ontbinding van een geregistreerd partnerschap en daarmee verband houdende verzoeken tot het treffen van een voorlopige voorziening of een nevenvoorziening, vindt een verwijzing als bedoeld in het eerste lid slechts plaats indien de andere echtgenoot of geregistreerde partner de bevoegdheid betwist.","In cases regarding divorce, legal separation, dissolution of marriage after legal separation and dissolution of a registered partnership and associated applications for an interim measure or an ancillary measure, referral as referred to Article 270(1) is made only where the other spouse or registered partner disputes jurisdiction.",nl-nl_civil-procedure-code-2025,book-1,,,,2025-02-11,Dutch_Code_of_Civil_Procecudre_Book_1.tmx,0006434
63573250-bb9c-412d-a03e-703872278f18,3.,3.,nl-nl_civil-procedure-code-2025,book-1,,,,2025-02-11,Dutch_Code_of_Civil_Procecudre_Book_1.tmx,0006437
62e10c14-71d2-40a3-826a-75fa73fd6caf,"Tegen de beslissing waarbij een betwisting van bevoegdheid wordt verworpen of de zaak naar een andere rechter wordt verwezen, is geen hogere voorziening toegelaten.",A decision denying a defence disputing jurisdiction or referring the case to another court is not subject to any higher remedy.,nl-nl_civil-procedure-code-2025,book-1,,,,2025-02-11,Dutch_Code_of_Civil_Procecudre_Book_1.tmx,0006440
2f940623-392c-449c-b30b-cc26318a836e,"De rechter naar wie de zaak is verwezen, is aan die verwijzing gebonden.",The court to which the case is referred is bound by that referral.,nl-nl_civil-procedure-code-2025,book-1,,,,2025-02-11,Dutch_Code_of_Civil_Procecudre_Book_1.tmx,0006443
a70f009a-1549-4baa-b50e-25601a9cee1b,De vorige zin mist toepassing indien de rechter zich tevens absoluut onbevoegd verklaart en de zaak verwijst naar een hogere rechter.,The previous sentence does not apply if the court also declines subject-matter jurisdiction and refers the case to a higher court.,nl-nl_civil-procedure-code-2025,book-1,,,,2025-02-11,Dutch_Code_of_Civil_Procecudre_Book_1.tmx,0006446
14e9da22-3683-4e9e-b4ef-572ae225e63c,DERDE AFDELING. OPROEPING,SECTION 3 - NOTICES TO APPEAR,nl-nl_civil-procedure-code-2025,book-1,,,,2025-02-11,Dutch_Code_of_Civil_Procecudre_Book_1.tmx,0006449
39db1e99-b932-46a7-9201-35803b16226f,Artikel 271,Article 271,nl-nl_civil-procedure-code-2025,book-1,,,,2025-02-11,Dutch_Code_of_Civil_Procecudre_Book_1.tmx,0006453
d18684f4-77e0-45d1-8b19-c4eed51e6d1c,"De oproeping van verzoekers of van in de procedure verschenen belanghebbenden geschiedt door de griffier bij gewone brief, tenzij de rechter anders bepaalt.","The clerk issues notices to appear to the applicants or the interested parties who have appeared in the action by regular mail, except where the court directs otherwise.",nl-nl_civil-procedure-code-2025,book-1,,,,2025-02-11,Dutch_Code_of_Civil_Procecudre_Book_1.tmx,0006456
e10eb21c-ade2-47c3-9978-1a823a50e34b,Artikel 272,Article 272,nl-nl_civil-procedure-code-2025,book-1,,,,2025-02-11,Dutch_Code_of_Civil_Procecudre_Book_1.tmx,0006460
f6c09f2d-6238-425b-9f86-1061d8a4c38e,De oproeping van niet in de procedure verschenen belanghebbenden van wie de woonplaats of het werkelijk verblijf onbekend zijn geschiedt door plaatsing van de oproeping in de Staatscourant.,Notice to appear for interested parties who have not appeared in the proceedings and have no known domicile or actual abode is given by publishing the notice in the Government Gazette (,nl-nl_civil-procedure-code-2025,book-1,,,,2025-02-11,Dutch_Code_of_Civil_Procecudre_Book_1.tmx,0006463
cf2f7f76-6ea4-4267-8c6a-36dc24c65719,De rechter kan bepalen dat de oproeping tevens op andere wijze geschiedt.,The court may direct that notice also be given in a different manner.,nl-nl_civil-procedure-code-2025,book-1,,,,2025-02-11,Dutch_Code_of_Civil_Procecudre_Book_1.tmx,0006466
b16f055f-4e65-4358-bd39-8fae7a30dea7,"De oproeping van overige niet in de procedure verschenen belanghebbenden geschiedt door de griffier bij aangetekende brief, tenzij de rechter anders bepaalt.","The clerk gives the other interested parties who have not appeared in the proceedings notice to appear by registered mail, except where the court directs otherwise.",nl-nl_civil-procedure-code-2025,book-1,,,,2025-02-11,Dutch_Code_of_Civil_Procecudre_Book_1.tmx,0006469
2ab5cb54-7d78-446c-bcc4-56eb3225d441,Artikel 273,Article 273,nl-nl_civil-procedure-code-2025,book-1,,,,2025-02-11,Dutch_Code_of_Civil_Procecudre_Book_1.tmx,0006473
b6a8163f-ed29-4d5b-bba9-c9ee253c5a70,"De oproeping van een rechterlijke autoriteit, het openbaar ministerie of de raad voor de kinderbescherming geschiedt door de griffier bij gewone brief.","A notice to appear, given to a judicial authority, the Public Prosecutor or the Council for the Protection of Children, is effected by the clerk and by regular mail.",nl-nl_civil-procedure-code-2025,book-1,,,,2025-02-11,Dutch_Code_of_Civil_Procecudre_Book_1.tmx,0006476
683437a4-73f3-4e2b-b935-b3014f5adab7,Artikel 274,Article 274,nl-nl_civil-procedure-code-2025,book-1,,,,2025-02-11,Dutch_Code_of_Civil_Procecudre_Book_1.tmx,0006480
49c50fe8-05de-408c-bc75-117db4008bc5,"Oproepingen die bij brief geschieden, vermelden de dag van de verzending.",Notices to appear that are transmitted by regular mail must specify the date of dispatch.,nl-nl_civil-procedure-code-2025,book-1,,,,2025-02-11,Dutch_Code_of_Civil_Procecudre_Book_1.tmx,0006483
f24ea181-97ec-4d8b-83d0-06202e2b3342,Deze vermelding geschiedt niet slechts op de envelop.,This specification must not feature only on the envelope.,nl-nl_civil-procedure-code-2025,book-1,,,,2025-02-11,Dutch_Code_of_Civil_Procecudre_Book_1.tmx,0006486
9abd4492-693b-47cc-9417-e65923fac2fd,Artikel 275,Article 275,nl-nl_civil-procedure-code-2025,book-1,,,,2025-02-11,Dutch_Code_of_Civil_Procecudre_Book_1.tmx,0006490
e2776c53-10e2-444b-ad0c-b7b59f58aaab,"Indien de griffier een bij aangetekende brief verzonden oproeping terug ontvangt en hem blijkt dat de geadresseerde op de dag van verzending of uiterlijk een week nadien in de daartoe bestemde registers ingeschreven stond op het op de oproeping vermelde adres, verzendt hij de oproeping onverwijld bij gewone brief.",The clerk transmits the notice by regular mail without delay if a notice to appear transmitted by registered mail is returned to the clerk and the clerk determines that the addressee was listed in the appropriate registers at the address stated in the notice on the day the notice was transmitted or no more than one week later.,nl-nl_civil-procedure-code-2025,book-1,,,,2025-02-11,Dutch_Code_of_Civil_Procecudre_Book_1.tmx,0006493
47ef4482-2d3d-4eca-82cd-c42b1333db7f,"In de overige gevallen waarin de griffier de oproeping terug ontvangt, verbetert de griffier, indien mogelijk, het op de oproeping vermelde adres en verzendt hij de oproeping opnieuw bij aangetekende brief, tenzij de rechter anders bepaalt.","In any other cases where the notice is returned to the clerk, the clerk, if possible, corrects the address stated in the notice and re-transmits the notice by registered mail, except where the court directs otherwise.",nl-nl_civil-procedure-code-2025,book-1,,,,2025-02-11,Dutch_Code_of_Civil_Procecudre_Book_1.tmx,0006496
08878d07-7398-49de-8e18-2800cc475409,Artikel 276,Article 276,nl-nl_civil-procedure-code-2025,book-1,,,,2025-02-11,Dutch_Code_of_Civil_Procecudre_Book_1.tmx,0006500
b1599a11-aea4-416f-82be-82c0f934033f,1.,1.,nl-nl_civil-procedure-code-2025,book-1,,,,2025-02-11,Dutch_Code_of_Civil_Procecudre_Book_1.tmx,0006503
d9efe253-057c-423a-a6b2-d696442d8c31,"Oproepingen vermelden de plaats, de dag en het uur van de terechtzitting.","Notices to appear specify the place, date and time of the hearing.",nl-nl_civil-procedure-code-2025,book-1,,,,2025-02-11,Dutch_Code_of_Civil_Procecudre_Book_1.tmx,0006506
8f2dae81-3da1-4410-b001-fd8a60fc37dd,"Zij worden zo spoedig mogelijk en ten minste een week vóór die dag verzonden, tenzij de rechter anders bepaalt.","They are transmitted as soon as possible and at least one week before that date, except where the court directs otherwise.",nl-nl_civil-procedure-code-2025,book-1,,,,2025-02-11,Dutch_Code_of_Civil_Procecudre_Book_1.tmx,0006509
b948dbeb-184d-4033-9430-a2f38185d675,2.,2.,nl-nl_civil-procedure-code-2025,book-1,,,,2025-02-11,Dutch_Code_of_Civil_Procecudre_Book_1.tmx,0006512
b42f7afe-53ba-4c0f-a569-6171b286f3d1,"De oproeping bevat tevens de mededeling of voor de indiening van een verweerschrift griffierecht zal worden geheven en dat indien de verweerder het verschuldigde griffierecht niet tijdig heeft voldaan de rechter het ingediende verweerschrift niet bij zijn beslissing op het verzoek betrekt, binnen welke termijn dit griffierecht betaald dient te worden, alsmede een verwijzing naar een vindplaats van de meest recente bijlage behorende bij de Wet griffierechten burgerlijke zaken waarin de hoogte van de griffierechten staan vermeld.","The notice states whether a court fee will be charged on the submission of a statement of defence and, if so, that the court will disregard in its decision any statement of defence that may have been submitted, if the defendant has not paid the court fee on time. The notice also states the time limit for payment of the court fee, as well as a reference to a publication where the current annex to the Court Fees (Civil Cases) Act (",nl-nl_civil-procedure-code-2025,book-1,,,,2025-02-11,Dutch_Code_of_Civil_Procecudre_Book_1.tmx,0006515
6ac9a7fa-4fc0-4496-a265-c408c0b11655,"Hierbij wordt vermeld dat van een persoon die onvermogend is, een bij of krachtens de wet vastgesteld griffierecht voor onvermogenden wordt geheven, indien hij op het tijdstip waarop het griffierecht wordt geheven heeft overgelegd:","The notice also states that a person who has limited financial means will be charged a court fee for persons of limited financial means set by or pursuant to law if, when the court fee is charged, the person has submitted:",nl-nl_civil-procedure-code-2025,book-1,,,,2025-02-11,Dutch_Code_of_Civil_Procecudre_Book_1.tmx,0006518
8e84a2dc-5bc2-452c-aae6-db6c5690fb80,"1°.	een afschrift van het besluit tot toevoeging, bedoeld in artikel 29 van de Wet op de rechtsbijstand, of indien dit niet mogelijk is ten gevolge van omstandigheden die redelijkerwijs niet aan hem zijn toe te rekenen, een afschrift van de aanvraag als bedoeld in artikel 24, tweede lid, van de Wet op de Rechtsbijstand, dan wel","1°.	a copy of the decision to grant legal aid, as referred to in Article 29 of the Legal Aid Act (",nl-nl_civil-procedure-code-2025,book-1,,,,2025-02-11,Dutch_Code_of_Civil_Procecudre_Book_1.tmx,0006521
dd0bd2e8-5e0e-4e2d-a33d-667166168aab,"2°.	een verklaring van het bestuur van de raad voor rechtsbijstand als bedoeld in artikel 7, derde lid, onderdeel e, van de Wet op de rechtsbijstand waaruit blijkt dat zijn inkomen niet meer bedraagt dan de inkomens, bedoeld in de algemene maatregel van bestuur krachtens artikel 35, tweede lid, van die wet.",2°.	a declaration by the board of the Legal Aid Council as referred to in Article 7(3) (e) of the Legal Aid Act (,nl-nl_civil-procedure-code-2025,book-1,,,,2025-02-11,Dutch_Code_of_Civil_Procecudre_Book_1.tmx,0006524
293676f8-29d1-4d76-97ed-3ca4b319338a,3.,3.,nl-nl_civil-procedure-code-2025,book-1,,,,2025-02-11,Dutch_Code_of_Civil_Procecudre_Book_1.tmx,0006527
bca64003-946a-4fe9-85cb-9f05e2aaac71,"Indien het een zaak betreft waarbij meerdere belanghebbenden zijn betrokken, bevat de oproeping tevens de mededeling dat van belanghebbenden die bij dezelfde advocaat verschijnen en gelijkluidende verweerschriften indienen, op basis van artikel 15 van de Wet griffierechten burgerlijke zaken slechts eenmaal een gezamenlijk griffierecht wordt geheven.","If there are multiple interested parties in the case, the notice must state that interested parties who appear by the same lawyer and submit identical statements of defence will only be charged a single collective court fee on the basis of Article 15 of the Court Fees (Civil Cases) Act (",nl-nl_civil-procedure-code-2025,book-1,,,,2025-02-11,Dutch_Code_of_Civil_Procecudre_Book_1.tmx,0006530
91c2d42a-7ce5-48ae-b07c-2e6c73dbefb4,Artikel 277,Article 277,nl-nl_civil-procedure-code-2025,book-1,,,,2025-02-11,Dutch_Code_of_Civil_Procecudre_Book_1.tmx,0006534
53102fe0-4369-4f30-8fb4-89b357523339,1.,1.,nl-nl_civil-procedure-code-2025,book-1,,,,2025-02-11,Dutch_Code_of_Civil_Procecudre_Book_1.tmx,0006537
09fddd54-30a7-4c27-826e-31783dc0f356,"De oproeping bij brief van verzoekers of belanghebbenden die geen bekende woonplaats of bekend werkelijk verblijf in Nederland hebben, maar wel een bekende woonplaats of een bekend werkelijk verblijf in een Staat waar de verordening (EU) 2020/1784 van het Europees Parlement en de Raad van 25 november 2020 inzake de betekening en de kennisgeving in de lidstaten van gerechtelijke en buitengerechtelijke stukken in burgerlijke of in handelszaken (de betekening en kennisgeving van stukken) van toepassing is, geschiedt door rechtstreekse verzending overeenkomstig artikel 18 van de verordening.","Applicants or interested parties who have no known domicile or known place of actual abode in the Netherlands, but do have an known domicile or known place of actual abode in a State where Regulation (EU) No 2020/1784 of the European Parliament and of the Council of 25 November 2020 on the service in the Member States of judicial and extrajudicial documents in civil or commercial matters (service of documents) is applicable, are given notice to appear directly by mail in accordance with Article 18 of the Regulation.",nl-nl_civil-procedure-code-2025,book-1,,,,2025-02-11,Dutch_Code_of_Civil_Procecudre_Book_1.tmx,0006540
37eb224a-969c-4e46-84f4-73daad81a7e3,"In plaats daarvan mag het gerecht ook een vertaling van de oproeping verzenden in een taal als bedoeld in artikel 12, eerste lid, van de verordening.","As an alternative, the court may also transmit a translation of the document in a language as referred to in Article 12(1) of the Regulation.",nl-nl_civil-procedure-code-2025,book-1,,,,2025-02-11,Dutch_Code_of_Civil_Procecudre_Book_1.tmx,0006543
1437f648-563f-4f51-8262-22d18f80e57a,"Het gerecht maakt in de oproeping melding van de verzending, alsmede van het volgende:","The court enters a note of the transmission on the document, as well as of the following information:",nl-nl_civil-procedure-code-2025,book-1,,,,2025-02-11,Dutch_Code_of_Civil_Procecudre_Book_1.tmx,0006546
efd056ec-fbb0-4c5c-bcbe-83cbae04a723,a.	de datum van verzending;,a.	the date of transmission;,nl-nl_civil-procedure-code-2025,book-1,,,,2025-02-11,Dutch_Code_of_Civil_Procecudre_Book_1.tmx,0006549
f84ebdad-902a-405b-b917-3aa4863e233b,b.	de wijze van verzending;,b.	the manner of transmission;,nl-nl_civil-procedure-code-2025,book-1,,,,2025-02-11,Dutch_Code_of_Civil_Procecudre_Book_1.tmx,0006552
6571fe67-c8cc-4c2b-8507-b2dacebf6273,"c.	of een vertaling is verzonden en zo ja, in welke taal;","c.	whether a translation has been transmitted and, if so, in which language;",nl-nl_civil-procedure-code-2025,book-1,,,,2025-02-11,Dutch_Code_of_Civil_Procecudre_Book_1.tmx,0006555
ecdcb902-675d-423e-85ba-46f2e9b0387a,"d.	de mededeling in een van de in artikel 12, eerste lid, van de verordening bedoelde talen, dat degene voor wie het stuk bestemd is, dit mag weigeren als het niet gesteld is in of niet vergezeld gaat van een vertaling in een van de in artikel 12, eerste lid, van de verordening bedoelde talen en dat geweigerde stukken naar hem moeten worden gezonden.","d.	the notification in one of the languages as referred to in Article 12(1) of the Regulation stating that the addressee may refuse to accept the document if it is not written in, or accompanied by a translation into, one of the languages as referred to in Article 12(1) and that the refused documents are to be transmitted to the court.",nl-nl_civil-procedure-code-2025,book-1,,,,2025-02-11,Dutch_Code_of_Civil_Procecudre_Book_1.tmx,0006558
844420ec-5273-4d7b-be43-6113598bd534,2.,2.,nl-nl_civil-procedure-code-2025,book-1,,,,2025-02-11,Dutch_Code_of_Civil_Procecudre_Book_1.tmx,0006561
fb86f0e5-6f33-447a-9027-976238486002,"Het gerecht mag de oproeping ook verrichten door verzending daarvan aan een ontvangende instantie als bedoeld in artikel 3, tweede lid, van de verordening, ter betekening aan degene voor wie de oproeping bestemd is, via het systeem zoals bedoeld in artikel 5, eerste lid, van de verordening of via alternatieve middelen van verzending in het geval van artikel 5, vierde lid, van de verordening.","The court may also give notice by transmitting it to a receiving agency, as referred to in Article 3(2) of the Regulation, to be served on the addressee via the system as referred to in Article 5(1) of the Regulation or through alternative means of transmission in the case of Article 5(4) of the Regulation.",nl-nl_civil-procedure-code-2025,book-1,,,,2025-02-11,Dutch_Code_of_Civil_Procecudre_Book_1.tmx,0006564
6bcac53d-5cf3-424d-a9c0-231010aecb1c,"Indien de oproeping niet is opgesteld in een van de in artikel 12, eerste lid, van de verordening bedoelde talen, verzendt het gerecht ook een vertaling in een taal als bedoeld in artikel 12, eerste lid, van de verordening.","If the notice is not in one of the languages as referred to in Article 12(1) of the Regulation, the court also sends a translation in a language as referred to in Article 12(1) of the Regulation.",nl-nl_civil-procedure-code-2025,book-1,,,,2025-02-11,Dutch_Code_of_Civil_Procecudre_Book_1.tmx,0006567
fbb33d6b-9ae8-4575-8a55-a7d4eafe569a,"Het gerecht maakt in de oproeping melding van de verzending, alsmede van volgende gegevens:","The court enters a note of the transmission on the document, as well as of the following information:",nl-nl_civil-procedure-code-2025,book-1,,,,2025-02-11,Dutch_Code_of_Civil_Procecudre_Book_1.tmx,0006570
6b723bd9-0827-40a8-82bb-04cbd390a77b,a.	de datum van verzending;,a.	the date of transmission;,nl-nl_civil-procedure-code-2025,book-1,,,,2025-02-11,Dutch_Code_of_Civil_Procecudre_Book_1.tmx,0006573
990bf40d-4f51-4749-82e9-473d62d7ea2d,b.	de naam en het adres van de ontvangende instantie;,b.	the name and address of the receiving agency;,nl-nl_civil-procedure-code-2025,book-1,,,,2025-02-11,Dutch_Code_of_Civil_Procecudre_Book_1.tmx,0006576
a5beead3-d315-4beb-82b6-f93129ab6dc3,c.	de wijze van verzending;,c.	the manner of transmission;,nl-nl_civil-procedure-code-2025,book-1,,,,2025-02-11,Dutch_Code_of_Civil_Procecudre_Book_1.tmx,0006579
22fa2dc0-e754-4d93-9f90-af732e2e237f,"d.	in het geval van artikel 5 lid 4 van de verordening, de reden van de verzending met alternatieve middelen;","d. 	in the case of Article 5(4) of the Regulation, the reason for transmission by alternative means;",nl-nl_civil-procedure-code-2025,book-1,,,,2025-02-11,Dutch_Code_of_Civil_Procecudre_Book_1.tmx,0006582
a3eb08a0-e112-4378-be3d-5f1914e53122,"e.	of een vertaling is meegezonden en, zo ja, in welke taal;","e.	whether a translation has been transmitted and, if so, in which language;",nl-nl_civil-procedure-code-2025,book-1,,,,2025-02-11,Dutch_Code_of_Civil_Procecudre_Book_1.tmx,0006585
104a2744-0431-4173-b883-8c66fe654f22,"f.	de taal waarin het formulier als bedoeld in artikel 8, tweede lid, van de verordening is ingevuld;","f.	the language in which the form as referred to in Article 8(2), of the Regulation has been completed;",nl-nl_civil-procedure-code-2025,book-1,,,,2025-02-11,Dutch_Code_of_Civil_Procecudre_Book_1.tmx,0006588
92257639-9953-4a51-bc5f-3f8fb86c8c19,g.	de gevraagde wijze van betekening.,g.	the requested manner of service.,nl-nl_civil-procedure-code-2025,book-1,,,,2025-02-11,Dutch_Code_of_Civil_Procecudre_Book_1.tmx,0006591
eb9cd851-dc31-40a8-9ae2-72d992bd25bf,VIERDE AFDELING. VERLOOP VAN DE PROCEDURE,SECTION 4 - THE PROCEEDINGS,nl-nl_civil-procedure-code-2025,book-1,,,,2025-02-11,Dutch_Code_of_Civil_Procecudre_Book_1.tmx,0006594
364004d8-9d5c-48d7-9b33-c713907b92c9,Artikel 278,Article 278,nl-nl_civil-procedure-code-2025,book-1,,,,2025-02-11,Dutch_Code_of_Civil_Procecudre_Book_1.tmx,0006598
0a6b6d4b-d597-47f0-b44a-39b31f11ab0f,1.,1.,nl-nl_civil-procedure-code-2025,book-1,,,,2025-02-11,Dutch_Code_of_Civil_Procecudre_Book_1.tmx,0006601
9cbfb06a-b47e-4e5f-abc8-1d63c6a3bcc1,"Het verzoekschrift vermeldt de voornamen, naam en woonplaats of, bij gebreke van een woonplaats in Nederland, het werkelijk verblijf van de verzoeker, alsmede een duidelijke omschrijving van het verzoek en de gronden waarop het berust.","The application states the given name, surname and domicile or, if there is no domicile in the Netherlands, the actual abode of the applicant, as well as a clear description of the application and the grounds on which it is based.",nl-nl_civil-procedure-code-2025,book-1,,,,2025-02-11,Dutch_Code_of_Civil_Procecudre_Book_1.tmx,0006604
d6bd98de-f886-4266-ae48-0da44e1c081c,In zaken betreffende een nalatenschap vermeldt het verzoekschrift tevens de laatste woonplaats van de overledene of de reden waarom deze vermelding niet mogelijk is.,"In cases concerning an inheritance, the application must also state the decedent's last domicile or the reason why it cannot be stated.",nl-nl_civil-procedure-code-2025,book-1,,,,2025-02-11,Dutch_Code_of_Civil_Procecudre_Book_1.tmx,0006607
2b7be967-9c57-4832-9850-9fc0735688c6,"De artikelen 111, derde lid, en 120, vierde lid, zijn van overeenkomstige toepassing, tenzij de aard van de zaak of de procedure zich hiertegen verzet.",Articles 111(3) and 120(4) apply,nl-nl_civil-procedure-code-2025,book-1,,,,2025-02-11,Dutch_Code_of_Civil_Procecudre_Book_1.tmx,0006610
659f9a57-3de0-45fc-ad78-797845ac8dd0,2.,2.,nl-nl_civil-procedure-code-2025,book-1,,,,2025-02-11,Dutch_Code_of_Civil_Procecudre_Book_1.tmx,0006613
dccfa717-0aec-455a-8f6b-897b98e614f3,Het verzoekschrift wordt ondertekend en ter griffie ingediend.,The application is signed and submitted to the court office.,nl-nl_civil-procedure-code-2025,book-1,,,,2025-02-11,Dutch_Code_of_Civil_Procecudre_Book_1.tmx,0006616
53e4dd9b-b8cd-42e0-aca3-30e228ba2c1f,"Indien de voorzieningenrechter daarop moet beschikken, kan het aan deze ter hand worden gesteld.","If the application is to be decided on by the court in summary proceedings, it may be handed to the judge of that court in person.",nl-nl_civil-procedure-code-2025,book-1,,,,2025-02-11,Dutch_Code_of_Civil_Procecudre_Book_1.tmx,0006619
366a1040-3cc0-4dc4-ad89-62235de598fb,3.,3.,nl-nl_civil-procedure-code-2025,book-1,,,,2025-02-11,Dutch_Code_of_Civil_Procecudre_Book_1.tmx,0006622
60b8707a-0882-4ed8-a0f9-423618ea6c23,"Tenzij indiening bij de kantonrechter plaatsvindt of ingevolge bijzondere wettelijke bepaling niet door een advocaat behoeft te geschieden, wordt het verzoekschrift ondertekend door een advocaat.","The application must be signed by a lawyer, except where the application is submitted to the subdistrict court or, under a special statutory provision, does not need to be submitted by a lawyer.",nl-nl_civil-procedure-code-2025,book-1,,,,2025-02-11,Dutch_Code_of_Civil_Procecudre_Book_1.tmx,0006625
03799e26-15ad-48a0-8ad5-8921635f715f,Het kantoor van die advocaat geldt als gekozen woonplaats van de verzoeker.,The office of that lawyer is treated as the applicant's elected domicile.,nl-nl_civil-procedure-code-2025,book-1,,,,2025-02-11,Dutch_Code_of_Civil_Procecudre_Book_1.tmx,0006628
782d342d-78e7-453f-abac-a2dd7149a238,4.,4.,nl-nl_civil-procedure-code-2025,book-1,,,,2025-02-11,Dutch_Code_of_Civil_Procecudre_Book_1.tmx,0006631
1b396f33-050e-441c-9c2e-f98f10986a37,De griffier tekent de dag van indiening of de dag van terhandstelling aan de voorzieningenrechter op het verzoekschrift aan.,The clerk marks the application with the date of submission to the court office or to the judge of the court in summary proceedings.,nl-nl_civil-procedure-code-2025,book-1,,,,2025-02-11,Dutch_Code_of_Civil_Procecudre_Book_1.tmx,0006634
98b9394e-96b1-44ba-874a-14f1d8e28772,Artikel 279,Article 279,nl-nl_civil-procedure-code-2025,book-1,,,,2025-02-11,Dutch_Code_of_Civil_Procecudre_Book_1.tmx,0006638
0bcd4f09-e36a-4a12-812a-700dffcefe78,1.,1.,nl-nl_civil-procedure-code-2025,book-1,,,,2025-02-11,Dutch_Code_of_Civil_Procecudre_Book_1.tmx,0006641
80c00939-434e-42fd-9fb7-ed2ee21b335e,"De rechter bepaalt, tenzij hij zich aanstonds onbevoegd verklaart of het verzoek toewijst, onverwijld dag en uur waarop de behandeling aanvangt.","Except for where it immediately declines jurisdiction or grants the application, the court directs without delay the date and time when the hearing will convene.",nl-nl_civil-procedure-code-2025,book-1,,,,2025-02-11,Dutch_Code_of_Civil_Procecudre_Book_1.tmx,0006644
5b5f6806-a4a5-4d83-810f-123e00f4a071,Hij beveelt tevens oproeping van de verzoeker en voor zover nodig van de in het verzoekschrift genoemde belanghebbenden.,"The court also orders that notice to appear be given to the applicant as well as, where applicable, the interested parties referred to in the application.",nl-nl_civil-procedure-code-2025,book-1,,,,2025-02-11,Dutch_Code_of_Civil_Procecudre_Book_1.tmx,0006647
45e60aa4-2035-4576-8f48-b8be1a51cade,"Bovendien kan hij te allen tijde belanghebbenden, bekende of onbekende, doen oproepen.",The court may at any time direct that known or unknown interested parties be given notice to appear.,nl-nl_civil-procedure-code-2025,book-1,,,,2025-02-11,Dutch_Code_of_Civil_Procecudre_Book_1.tmx,0006650
8d1c57c3-4b68-4371-98f4-21a10c7c1283,2.,2.,nl-nl_civil-procedure-code-2025,book-1,,,,2025-02-11,Dutch_Code_of_Civil_Procecudre_Book_1.tmx,0006653
